title,body,coms,num_coms,age,subreddit
Do other people notice songs being uploaded on the wrong artist’s page more often?,"I’ve been using Spotify for years now without problems but recently I see more and more songs and sometimes even albums being uploaded on the page of other artists, who share their name.

Nothing worse than being excited by a surprise song release and then finding out it’s not even theirs. This seems to occur more and more frequently recently but that could just be my experience.","['This definitely happens, but not the way you probably imagine. Artists don\'t ""upload songs to a page"". Distributors send music to Spotify in bulk deliveries. Each release and track has metadata to say which artists are involved. Ideally this is done using unique artist IDs, not just names, in which case there is no problem. \n\nBut some distributors don\'t provide IDs, just names. In these cases there is code on the Spotify end that earnestly tries to figure out which artist by that name is meant. It usually works! But not always. \n\nThis is why, when these errors DO happen, they usually take the form of an independent artist\'s work getting credited to a more popular artist, rather than vice versa.\n\nWe (I work at Spotify, though not specifically on this) try to catch mis-assigned new releases before they appear, but there are 40k+ new releases on Spotify every week, so it\'s...challenging.']",8,6.241363094595296,spotify
"Morning - Jazz Music for the Morning Drive, a playlist on Spotify",,0,0,6.2549742057064055,spotify
"Good fall playlist for my move from the bay area to Austin, Texas. Mellow Country/Folk/Alt vibes to relax to",[https://open.spotify.com/playlist/0jDj0pZvXIMLH4UltVmLi6?si=m9xWo74VS2OZvPPZlqmNwA](https://open.spotify.com/playlist/0jDj0pZvXIMLH4UltVmLi6?si=m9xWo74VS2OZvPPZlqmNwA),0,0,6.259117724235963,spotify
"Loft Music - Deep, House, Electronica",,0,0,6.275483464990502,spotify
24+ hours of chill music. enjoy,,0,0,6.275865409445983,spotify
Rapid Strikes a mainstream Hip Hop album | 100+ songs and growing,,0,0,6.29028670574228,spotify
"Soft and nice rock, country, blues (Quality List)",,0,0,6.2988283724172245,spotify
Spotify app for iPhone 5 with below IOS11?,"I am unable to download the spotify app on an iPhone5, which highest IOS is 10.3.4. Spotify requires IOS11. Is there a way to install an old or alternative app to still listen to Spotify on an iPhone5?","['Time to upgrade your phone, I think...']",1,6.342821427983818,spotify
Acoustic Chill - Spotify Playlist [Coffeehouse Lounge],,0,0,6.34328439094678,spotify
"[Playlist][Acoustic]Had my fill of ""Halloween"" music. Back to relaxing, soothing indie acoustic guitar.",,['Beautiful thank you!'],1,6.368608465034653,spotify
"Fresh, old and underrated EDM, Dance, Tropical/Progressive House, Upbeat EDMs 2010s for parties, clubs, runnings, work out etc. Updated weekly. {playlist}",,['Hey I like this playlist a lot I figure I might as well share my playlist with you it is basically my version of the vibe that you were going for\n\nhttps://open.spotify.com/playlist/2MAYYlfQr6S6PN7Z5zjizF?si=aiOgy2rKSTCqGJaD8Uxn5g'],1,6.396351520601247,spotify
Enjoy your roadtrip with Indie Rock/Pop/Folk roadtrip spotify playlist. Updated weekly. {playlist},,0,0,6.398272816897543,spotify
"Have account on phone, trying to log in to same account on computer.","I have a premium account on my phone, complete with a proper username.

How do I log in to the same account on a different device? I've tried logging in using two different emails, but with both the username is just a randomly generated long string. I don't know what email my phone account may be linked to.","['Is it possibly linked to your Facebook?', ""When you go into your account on your phone you should be able to see what username it is and the email that it's connected too.""]",3,6.4148005946863575,spotify
[Request] A Playlist featuring Future,"Idk if this is the right place for this, but I was wondering if someone could point me to a playlist, or make one for me? Going through some things now and i want it to be all Future or featuring Future. But only songs that are similar to Red Light, Codeine Crazy, March Madness, Special, ect. Basically his crooning and rapping, but not the drug selling and stuff.",0,0,6.421779761366822,spotify
Chirr Chill - Growing Circles [Album-Playlist],,0,0,6.426501983589045,spotify
How do I add part of an album to my library?,"Essentially as the title. When I'm looking to play albums, it's really irritating that some are only available in deluxe editions with redundant bonus tracks. I used to be able to achieve this by selecting multiple tracks and adding those to my library, but this feature seems to have been removed, and 'liking' individual songs doesn't let me display them by album in my library. Any ideas?","['I think you would need to create a playlist, then drag and drop the album tracks that you like to the playlist.']",3,6.428920965081564,spotify
"If my wife joins my duo plan, does she need to cancel her subscription?",,['Do you mean family plan?'],2,6.4518955021186,spotify
"A playlist to started off your Sunday with. Just 20 cute songs, from 2018-2019. Relatively new stuff. Something to clean to or drive to or a walk around your favorite park. Enjoy <3",,[],1,6.487624668796305,spotify
"Looking for new kind of genres?, try out this independent experimental bass playlist, right in da feels, 🥶👍 Wavemob",,0,0,6.520900131759268,spotify
Best EDM Music I could find!Enjoy! Also accepting criticism and suggestions :),,"[""Greetings! I'm a producer out of LA and i have a few tracks that may fit your playlist. Would appreciate if you take a listen when you have a chance. Cheers.\n\n[https://open.spotify.com/track/0KBp4HPqDkmCMiLilZ06NF](https://open.spotify.com/track/0KBp4HPqDkmCMiLilZ06NF)\n\n[https://open.spotify.com/track/6IcnYAHJJ2lrGCr6edLugC](https://open.spotify.com/track/6IcnYAHJJ2lrGCr6edLugC)"", ""https://open.spotify.com/playlist/2MAYYlfQr6S6PN7Z5zjizF?si=aiOgy2rKSTCqGJaD8Uxn5g\n\n So this is a giant playlist I have put together with a loose theme of summertime vibes, and I feel like there's no way you won't find stuff you like in here... this style of music is not necessarily my favorite I'm more into heavy bass driven stuff But there is for sure a time and place for it""]",6,6.54633994658788,spotify
"I made a playlist from kinda old music, the most recent songs are from 2000. Comment suggestions to put in the playlist!",,0,0,6.591802909561881,spotify
"Hardstyle - Got a playlist with oldschool, euphoric and raw style.","Hey guys got a playlist with an assortment of Hardstyle. Had the playlist for a very long time collecting the most notable songs and albums. Thought I'd share it around and please let me know if there are any you'd want added! Currently have just over 350 songs :)

[https://open.spotify.com/playlist/1ItKjs0oHRoWaYvF6WFAao?si=9zZlcsKOTFmiu-Lu4NY82Q](https://open.spotify.com/playlist/1ItKjs0oHRoWaYvF6WFAao?si=9zZlcsKOTFmiu-Lu4NY82Q)",0,0,6.660182539191511,spotify
"A mix of classic and new Christmas tunes, shuffle it! 🎄",,['Why are there no Christmas Stations on Spotify?  Just Playlists.\n\nMakes no sense.'],1,6.727416335496086,spotify
"How do you set speakers to ""Multi Mode"" so Spotify Connect can play from multiple devices?","Hello, I am trying to follow the guide Spotify has on its help page for being able to play out of multiple Spotify Connect Enabled devices at the same time, but I cant figure it out.  
https://support.urbanears.com/hc/en-us/articles/115002243069-How-to-Speakers-Play-in-Multi-Mode-via-Spotify-Connect

Thats their guide but it doesnt actually tell me how to change the devices to ""multi mode"". 

Here is a screenshot of what I see from the Device Menu.

https://imgur.com/a/Tz3dDFq

I am trying to play from ""upstairs"" and ""bedroom"".

Thanks!",0,0,6.756293650321939,spotify
Looking for some new artists,Hi! So I’ve been looking to find some artists that aren’t mainstream artists. But everytime I try to find them the only way I can search is through the most recent albums. Is there an easier way to find unpopular rappers? Like a top 250 rappers currently or top 100 upcoming rappers list?,"[""I manage [this rapper](https://open.spotify.com/artist/4n3BiuRU79B4qPqiqsnhQ4?si=Nn8aZuNPTOi01lz-y6D4FQ) who you might like, but also\n\nThis user has algorithm-generated playlists of all new artists under the name 'The Edge of [Whatever Genre], you can find his stuff here: [Particle Detector](https://open.spotify.com/user/particledetector?si=Kt2k5-zKQJ2hb7GzyQgl5g)"", 'https://open.spotify.com/artist/6wpfRLAe3c3idieJuv0fUv?si=XX4YxzQpTCGNzWwFV5-YYw\n\nTry this, is a new rapper', 'If youre into chill hiphop (mac miller/chance vibe) check out nbxdy\n\n[Spotify - Nbxdy](https://open.spotify.com/artist/0ZqXiwKiNYv9acmgq6rUyd)\n\nDude has good music. Not too many tracks, but all are dope in their own way.']",6,6.8269186503357355,spotify
M@D RICK new track out https://www.youtube.com/watch?v=3-qlPNsUpHk,https://www.youtube.com/watch?v=3-qlPNsUpHk,0,0,6.845309854050478,spotify
Does Spotify ever offer coupons or 1 year pre pay discounts?,,"[""Not that I know of.  Generally it has some sort of promo for new users.  There might be some sort of new user promo that's offered around the holiday season.""]",1,6.857705687394849,spotify
Fool of Myself an ElectroPop playlist about falling for someone that you can't be with,,0,0,6.862508928135589,spotify
"Joe Henderson - Greatest Solos Collection, a playlist on Spotify",,0,0,6.905564483704942,spotify
Google home mini,I received my free google home mini and it is still sealed in the box. I might give it to a friend as a Christmas gift or sell it. Does it have any of my personal information or Spotify account on the google home mini? I want to make sure it doesn’t have any of my information or account on it already.,"['No, it doesn’t have anything on it. Its a brand new google home mini']",2,6.910101520753017,spotify
"For anyone who likes to listen to music as they fall asleep, I have a 45 hr playlist of chill indie/folk/mishmash that is good",,"['I’m gonna try this one, thanks bruh', 'So you want me to go to sleep for 2 whole days while I could be out and about? Psssh nice try, OP!', 'https://open.spotify.com/playlist/0rmd4Bk7wUncTQgRttYATy?si=fCtNJ5OnQf6IsChIKpPp3w']",5,6.920471891134426,spotify
Has Spotify Been Hacked?,"I was listening to Spotify and all of a sudden it kept saying I was listening on a different device but I've never seen these devices before and they keep getting added.
What's going on and what should I do?
http://imgur.com/a/jQIIHbn","['Sounds like someone has got your account details, best thing to do is go onto the website reset your password and Spotify has a feature that logs your account out of all devices. This will be Abit annoying if you have a lot of devices you must enter new password but worth it overall. 😀', 'Someone probably sold your account details  \nBetter check https://haveibeenpwned.com if any of your other accounts have been compromised, and change the password immediately', ""Yes, it sounds like you've been hacked.  Go into your account, log out of all devices and change your password right away.  Then log back into your devices.  You might want to consider using a password manager to randomly generate a very secure password."", 'Were you on a public WiFi?']",5,6.931918650393685,spotify
Prepping for an interview and hoping for respondents to this research survey on Spotify. (Job is for a different company),"Hey everyone, I'm far into the interview process at a company and they have asked me to make a pitch for how I would go about improving Spotify. The role is for a different company so the work I'm doing is completely theoretical.

I'm hoping to get some responses for a research survey that I made that would help inform how I go about this. Thanks in advance!

[**Survey link**](https://forms.gle/qhynxgPfwEZauQNX7)",0,0,6.943967261515834,spotify
So there's a new offer..,".. there's a new offer for Spotify that if you buy Spotify premium you get a free Google home mini. Now if I buy premium, get the Google mini, and refund the premium, do I basically get the Google mini for free?","['well...... I guess ¯\\\\\\_(ツ)\\_/¯', ""Just FYI this also applies to anyone who already has premium. You need to link your Spotify account to your Google account if you haven't already, and the free shipping is a month but hey, free stuff."", 'I did something similar last year when they had the offer. I cancelled it after the first month. Basically paid $10 for a Google home mini. But this was in Canada', 'Free shipping for me took a week. Just got mine.']",4,6.953238094862964,spotify
"Recently just started listening to music again, but have older phone. I heard spotify is a big battery drainer, what do you think?",,"[""I don't have much of a problem with it.  Especially when the screen is dark.  Battery drain seems fairly minimal.  Now if you're phone doesn't hold a charge well, I'd think using just about anything on your phone would cause more serious battery drain.""]",3,6.973689483751854,spotify
brockhampton but soft,,[],1,6.982335317096225,spotify
when you're in luv and wanna make vids abt it,,0,0,6.985228835623021,spotify
No genre top list?,"This is pretty much the most basic feature I can think of for a music service .  Someone asked for it in 2012, they implemented and then removed it in 2016 for... reasons?

https://community.spotify.com/t5/Implemented-Ideas/Top-Lists-based-on-Genre/idi-p/1849

And then putting it on hold in 2017 because they don’t get 50 votes on the community site...

https://community.spotify.com/t5/Closed-Ideas/Browse-Top-Music-Lists-by-Genre/idc-p/1702143#M118832

I don’t understand what the point is in holding this feature ransom.",0,0,6.998643187474873,spotify
"Like hip hop, but no time to dig around for good music? Don't trust Spotify's algorithms, sometimes you need a human touch. I update every single day so you'll never have to dig again!",,"['Love it, thanks!', 'Hey guys, for some reason I cant see all your comments but you can submit your music here https://form.jotform.com/gvobeats/gvo-submission-form']",5,7.01054133563682,spotify
PLEASE HELP How to sort lists of playlists on Chromebook or Phone,"Hey, so I'm pulling my hair out. I recently switched from Google Play Music to Spotify so that I can easily control all of my devices and stereo that's connected to an old laptop.  That way my phone or chromebook are my remote.

But I'm not finding the most simple and basic thing that I need. To sort my list of playlists alphabetically.  When Im trying to add new music to various playlists or play various playlists, it's needlessly frustrating.

In Google Play or Apple Music you press a couple buttons to do this.

On teh Googlez it sounds like if I had the Windows Application I could do this, but I only have my Chromebook, an outdated windows laptop (that Spotify wont install on because it's too old) and my S9.

Am I overlooking some simple button? Or is this real not even an option in spotify? I read through the 3rd party apps list, but didn't find one that accomplishes this simple task.

Pleaaaseee hallppp

Thanks.","['No such feature.  However, you can manually ""drag & drop"" the playlists and therefore order them as you wish.  Not what you\'re looking for exactly, but the chromebook app SUX']",2,7.030414020833042,spotify
"Bedroom Diamonds, slow tunes for fast nights (6lack, Jhene Aiko, Partynextdoor, Drake) -updated weekly",,0,0,7.032126983796005,spotify
Bluetooth problems since Android 10,"Ever since I updated to Android 10 on my Pixel 3 I've had issues with playback over Bluetooth connection. Instead of dipping the volume down for a notification like it used to (although it hasn't done that since I got this phone) it pauses for a second. But now when it resumes after the notification sound it usually fails to output sound to the car. It keeps playing, but no sound over Bluetooth. A quick pause, a two second wait, and pushing play again *usually* solves the problem, but not always. Sometimes I have to force quit the app.
Notifications from Facebook and Lyft Driver apps nearly always do it, but Messenger and Android Messages almost never do. I have battery optimization off already, and I've cleared my cache and updated to the latest version. Amazon Music doesn't have this issue either. 
Ideas?","[""I have the Pixel 3XL. Sounds like it's just an issue with Spotify. Try reinstalling Spotify.""]",1,7.040738094918154,spotify
"Sunset Mood, a playlist by Wěi on Spotify",,0,0,7.04669874307734,spotify
Here's my new chilled/lazy Sunday at home playlist. Hope someone finds some enjoyment out of it :),,0,0,7.049314483818081,spotify
Anime playlist | Please Follow <3,,0,0,7.0662242060541,spotify
I can't log into my account,I disconnected my facebook profile from my  Spotify profile a long time ago and now its just a bunch of letters and numbers. I recently got a new phone and want to log into the account to transfer my songs but cant remember the password to the email but i also cannot log into facebook again. Any help?,0,0,7.074407076424471,spotify
"Alejandro Martinez - Harmony, No. 3 [Instrumental]",,0,0,7.130784391250323,spotify
25 hours of the best real country music from mid50s to now.,,[],1,7.176779761631732,spotify
Best Songs of 1999 ☆ 90s Classics,,0,0,7.21893253940951,spotify
"Hi everyone, here is a careful selection of different piano music, some classical tunes, some contemporary and also some unknown stuff.",,0,0,7.257427909793678,spotify
"Funky See, Funky Do",,[],1,7.2808075394343446,spotify
Is there anyway to play a local files playlist on Spotify when on ps4?,"Hey all,  new to this sub and I’ve been searching for a while and can’t find any info that’s not like 4 years old on this and I’m hoping there is a way to do this now? 

Basically I’ve downloaded a bunch of songs (Logic mixtapes if that means anything to anyone) and I’ve managed to use some posts here to add them to a desktop playlist and then download for offline to my iPhones which is fantastic! But now When I try to listen to these playlists on Spotify and then transfer playback to my ps4 it won’t play the songs. Does anyone know of any way to set it up so I can do this?",0,0,7.2828792986936035,spotify
Loft Music - Chill,,['Cool curation! Can I do a song suggestion?'],1,7.287694113516697,spotify
"Weekend Grooves 44 - Celebrating Soulful House, Deep House, Funk, 80s Boogie, Disco, Rare Grooves and Jazz flavours: http://soulfulgoodness.blogspot.no/",,['Cool curation! Can I do a song suggestion?'],1,7.2970343913055125,spotify
Anybody else wish you could browse through a long playlist with your keyboard?,"You know how in iTunes and other players you can just hit ""L"" on your keyboard and it immediately goes to the first L artist in your library? Or even if you type more than one letter, like ""Bea"" for instance, you could see the Beach Boys or the Beatles come up without having to type the whole band name into the search bar. 

This would be great to have in Spotify since it's my main means of listening to music now and my playlists are quite full and scrolling through thousands of songs to find a certain artist or album is a pain in the ass, especially since the search bar is at the very top of the playlist regardless of how far down you are in the playlist. And for some reason my scrolling bar on the right seems almost impossible to click and hold to get it to move up and down quickly. I end up dragging the entire window with it almost every time. Anybody else have similar problems and think this simple change would help a bit?","[""They actually did have this feature when sorting by artist (at least in the desktop version), don't know why it was removed...""]",1,7.3159580024166235,spotify
"A small playlist I made that has a mix of lofi, chillhop, and glitch",,"[""Greetings! I have a few new tracks that may fit your playlist. I'd appreciate if you take a listen when you have a moment. Thank you in\xa0advance.\n\nHere's the Spotify links  \n[https://open.spotify.com/track/3Npf6J5ANSrGwcRlz0yGCz](https://open.spotify.com/track/3Npf6J5ANSrGwcRlz0yGCz)  \n[https://open.spotify.com/track/2YJjctEzQErO6bL0TLCYDR](https://open.spotify.com/track/2YJjctEzQErO6bL0TLCYDR)"", 'Cool curation! Can I do a song suggestion?', 'i love swing theory, probably my favourite lofi tune. here is something cool that features a chet baker sample (probably my favourite male jazz vocalist. [https://open.spotify.com/track/01Oq8X3TUMnNgpm1Bt1Pqf?si=CY2zm97vRsKp6J7oyKsWtw](https://open.spotify.com/track/01Oq8X3TUMnNgpm1Bt1Pqf?si=CY2zm97vRsKp6J7oyKsWtw)']",11,7.333735780208198,spotify
Applescript to control output device on mac,"Does anybody know if it's possible to change Spotify output device through apple script? I am thinking of a custom button on the Touch Bar to toggle between Mac/phone/smartSpeakers using BTT.

Appreciate any help!","[""I'm a bot, *bleep*, *bloop*. Someone has linked to this thread from another place on reddit:\n\n- [/r/apple] [Applescript to control Spotify output device on mac](https://www.reddit.com/r/apple/comments/dqluea/applescript_to_control_spotify_output_device_on/)\n\n&nbsp;*^(If you follow any of the above links, please respect the rules of reddit and don't vote in the other threads.) ^\\([Info](/r/TotesMessenger) ^/ ^[Contact](/message/compose?to=/r/TotesMessenger))*""]",1,7.347694113541532,spotify
#wstar campaign,,0,0,7.347914020959978,spotify
How to stop canvas?,"Pretty much as the title says. 

Whenever I click to turn canvas off, I scroll through the settings a bit, go back to canvas and it's turned itself back on.

I've tried just backing out of the settings once turning it off, scrolling and doing other settings and force closing the app.

I don't want to select the low quality mode, so is there any other way to stop it reselecting itself?

Tried to post a screen video of it here earlier but the post got removed...",0,0,7.355275132071089,spotify
"Celtic Music Playlist | Best Scottish Songs, Irish Songs, Asturian & Galician Popular Songs",,0,0,7.386432539489534,spotify
"I´m doing a series called ""10 Minutes of new Music"" on Youtube and the songs I presente there, will be also on Spotify. So if you´re looking for fresh Edm/Pop tunes, this is your playlist. The playlist will only contain the last 4 weeks of the episodes, so it´s weekly updated!!!",,0,0,7.403469576540369,spotify
"Madame Psychosis: Just Epic Songs! A playlist full of songs that have progressive song structures, big crescendos, and huge moments contrasting their typically humble beginnings. If you've suggestions to add, please comment! Always looking for more stuff like this.",,[],2,7.409916335799628,spotify
"Made a Downtempo and Chill Playlist with beautiful Electronic Melodies. A balanced mix of known and lesser known artist, perfect for a road trip, relax or study to. Hope you enjoy",,"['I like your playlist! Thanks :) If you like downtempo and chill electronic tunes, [you might like this one too](https://open.spotify.com/playlist/2WabPlfuZJQ3crbLkFRQ10?si=6m48CcaMTyq1sGLk_f6fSA).', ' Cool curation! Can I do a song suggestion?', 'Nice one man. here is my downtempo selection :) [https://open.spotify.com/playlist/4RsCIJjEvrZmNL9yVrvpQT?si=WP\\_n5AiNS2CWRsmnFdlaJQ](https://open.spotify.com/playlist/4RsCIJjEvrZmNL9yVrvpQT?si=WP_n5AiNS2CWRsmnFdlaJQ)', 'I think I have a song that would fit perfectly on this list :)', 'Nice, I was just looking for something relaxing.', 'I really like this playlist! Gave it a follow :) I just dropped a track that I think fits the vibe. I would love to know what you think!\n\n[https://open.spotify.com/track/5GAtquT3ccm7JTZWQfWOTo?si=gxlgrPKeTwy7fHJyR1VNRg](https://open.spotify.com/track/5GAtquT3ccm7JTZWQfWOTo?si=gxlgrPKeTwy7fHJyR1VNRg)\n\nBest, Sweeps', 'Great, check out this new album [https://open.spotify.com/album/31EBxZyo400omvWRnM27rJ](https://open.spotify.com/album/31EBxZyo400omvWRnM27rJ)']",9,7.452705687662517,spotify
Mexican Popular Songs: Música Mexicana y Canciones de Mariachi,,0,0,7.463816798784666,spotify
"Cuban Music | Son Cubano, Rumba, Salsa Cubana y Boleros",,0,0,7.4652056876735555,spotify
Underground Pollen Playlist,Taking submissions for my new Pollen Underground playlist - the smaller the artist the better. [https://open.spotify.com/playlist/19LbivbLe8nnWXISEohX58?si=7qT4FDjNR52rXL6kmh0bzQ](https://open.spotify.com/playlist/19LbivbLe8nnWXISEohX58?si=7qT4FDjNR52rXL6kmh0bzQ),['\nTreasure - indie artist from uk\n\nhttps://open.spotify.com/track/2TCYBe3G3GE98YRD0er4u1?si=uUmo0uhcTtiHTD7OQNAHLg'],3,7.4869996691660745,spotify
Afternoon Tunes ☕️ The perfect soundtrack for your casual afternoon...,,['Cool curation! Can I do a song suggestion?'],2,7.498423280290984,spotify
Spotify R&B Playlist For Your Weekend!,,0,0,7.503122354365058,spotify
"Ultimate Guide To Britpop 🎙 Cool Britannia. For a good chunk of the late 80's and 90's, britpop managed to rule the world! Bands like Blur, Pulp, Oasis and Suede carried the torch for Cool Brittania. But there was much more great stuff. So check out this playlist for awesome Britpop anthems",,0,0,7.514337632153873,spotify
