title,body,coms,num_coms,age,subreddit
"rap, a playlist I've been growing for years. I'd say the playlist is more on the rough side with some chill bangers mixed in. Enjoy!",,['hey this might add to the playlist if u mess with it! [https://open.spotify.com/track/1L89ytcmeiHkcsXdJN8Sct](https://open.spotify.com/track/1L89ytcmeiHkcsXdJN8Sct)'],1,3.4062820680798205,spotify
60 hrs of rock/indie/alternative. Most of them you will never hear on the radio.,,0,0,3.426270494060936,spotify
Indie Psych Rock - where indie rock and psychedelia meet in the middle :) {spotify}{playlist},,0,0,3.4285853089364595,spotify
Smooth hip-hop beats for a night time drive. Stuff that complements a comfortable silence.,,"[""Greetings! I have a few new tracks that may fit your playlist. I'd appreciate if you take a listen when you have a moment. Thank you in\xa0advance.\n\nHere's the Spotify links\n\n[https://open.spotify.com/track/3Npf6J5ANSrGwcRlz0yGCz](https://open.spotify.com/track/3Npf6J5ANSrGwcRlz0yGCz)\n\n[https://open.spotify.com/track/2YJjctEzQErO6bL0TLCYDR](https://open.spotify.com/track/2YJjctEzQErO6bL0TLCYDR)""]",1,3.44941864238569,spotify
International Pop Songs: Músicas Pop Rock Mais Tocadas dos Anos 80 e 90,,0,0,3.4534116979964358,spotify
"Relaxing Music for Working | Relaxing Work Music, Soft Pop, Ballads, Relax Calm Songs",,0,0,3.45465012398307,spotify
"I put together a playlist of downtempo/electronica tracks with an emphasis on music that features the piano (Kiasmos, Jon Hopkins etc.) I hope you enjoy!",[https://open.spotify.com/playlist/4RsCIJjEvrZmNL9yVrvpQT?si=WgfI8OWySr6KM2PPPtt\_cA](https://open.spotify.com/playlist/4RsCIJjEvrZmNL9yVrvpQT?si=WgfI8OWySr6KM2PPPtt_cA),0,0,3.4570691055197407,spotify
Shuffle play on playlists,"Can someone tell Spotify that shuffle doesn't mean ""play every Rob scallon song in my playlist, then every Metallica song, then every etc. ""
I used to his shuffle once and it would, as the title implies, shuffle all of my music. Now I have to hit it 5+ times to get it to work efficiently in the slightest. 
(My playlist is organized by title, not artist, so it's not that it's not shuffling at all, it's just a bad shuffle.)",[],1,3.4574741982171937,spotify
"I´m doing a series called ""10 Minutes of new Music"" on Youtube and the songs I presente there, will be also on Spotify. So if you´re looking for fresh Edm/Pop tunes, this is your playlist. The playlist will only contain the last 4 weeks of the episodes, so it´s weekly updated!!!",,0,0,3.465414013089957,spotify
When will Spotify Wrapped 2019 stop collecting data?,,"['Last year it was end of October iirc.', 'Really? Shit. \n\nLooks like Nothing is Beautiful is taking my most listened to album again.']",5,3.491212624261777,spotify
Playlists for reading comics/manga?,"Found an online copy of Stone Ocean, anyone know a good reading playlist?",0,0,3.509117716909559,spotify
"I have made a {Playlist} with more than 10 hours of Elegant background music (jazz, folk, instrumental pop covers, classical, ambient) Nice music to have in the background when you have dinner or cocktail with your friends, also perfect for hotels, lounge, bars, lobby. Hope you will enjoy it.",,[],1,3.5266524392366407,spotify
"I have created a playlist feat. 100 low-fi, garage rock, fuzz, garage, psychedelic and neo-psychedelic masterpieces. Both independent and established artists. FFO FIDLAR, together PANGEA, LCD Soundsystem and more. Enjoy!",,0,0,3.5505181800353305,spotify
No album cover shown when i connect spotify via bluetooth in car,"Hi, i have this problem in my both cars, when i connect via bluetooth the album cover doesnt show on the screen, is there a fix for this?",0,0,3.551571420845058,spotify
Why the hell does Spotify keep switching off Shuffle and Loop?,"I literally never listen to anything on the app without both Shuffle and Loop enabled, but it keeps turning them off for some reason. Why???",0,0,3.5571038283104146,spotify
samsung active 2 watch is a $550 paperweight,"my FUCKING NEW 550 DOLLAR SAMSUNG ACTIVE 2 WATCH KEEPS TELLING ME I HAVE NO MUSIC EVEN THOUGH I HAVE DOWNLOADED IT AND NOW I HAVE A FUCKING 550 PAPERWIGHT ON MY FUCKING WRIST THAT DOES NOTHING WHEN I GO RUNNING YOU ABSOLUTE FUCKING TRASH CUNT USELESS SHITS...

&#x200B;

spotify you fucking useless cunts what are you going to do about it? i can't even contact you because for some reason twitter locked me out of my account and wants my damn phone number so now my twitter is locked because i wont give it so i cant contact your stupid support site on twitter. 

&#x200B;

FUCK",0,0,3.5744533654633495,spotify
Any Khruangbin lovers here? Here is my curated playlist of artists similar to their Deep Funk psyche rock style. Let me know if you want more of this kind of stuff :),,0,0,3.639198735877872,spotify
Any plans for a romantic dinner tonight?,"**Here is the perfect playlist. 1h 12 min on acoustic guitar.**

[**https://open.spotify.com/playlist/5Er4zkadINgdzmP9Vhheif?si=6Fqj-C3kQ\_GUeNkql2ghOw**](https://open.spotify.com/playlist/5Er4zkadINgdzmP9Vhheif?si=6Fqj-C3kQ_GUeNkql2ghOw)",0,0,3.6492566063089504,spotify
[SPOTIFY][AMBIENT SLEEP] An Ambient playlist running for 9 hours+ - No drums or vocals to distract you while falling asleep,,"['really enjoying this! i am also compiling a similar playlist.. have a listen :)\n\n[https://open.spotify.com/playlist/3h1KJ5uKzJ7baB9VKAGxWR](https://open.spotify.com/playlist/3h1KJ5uKzJ7baB9VKAGxWR)', 'Glad u liked it😇', 'Also i produce some of my own soothing ambient sounds. Maybe u will like- \n\nhttps://open.spotify.com/album/6VuA8f2g3CUowN4SazQyKJ?si=OW_R3MB0QTC6WV8kaf6KpQ']",6,3.6566524398161304,spotify
I picked my favorite lofi chill beats for study and get work done. For listeners of channels like chilledcow or bootlegboy,,"['Why is it always this picture', 'Much appreciated, been looking for a good chill playlist for the downtimes.', 'Thanks!', ""Greetings! I have a few new tracks that may fit your playlist. I'd appreciate if you take a listen when you have a moment. Thank you in\xa0advance.\n\nHere's the Spotify links\n\n[https://open.spotify.com/track/3Npf6J5ANSrGwcRlz0yGCz](https://open.spotify.com/track/3Npf6J5ANSrGwcRlz0yGCz)\n\n[https://open.spotify.com/track/2YJjctEzQErO6bL0TLCYDR](https://open.spotify.com/track/2YJjctEzQErO6bL0TLCYDR)"", 'Nice! I dig it :)\n\nThis is [my lo-fi/chill beats](https://open.spotify.com/playlist/2Pg28FNFMae0FLm6XbdRnv?si=vfhWgQnHTkyjrBieHCV1qA) list for studying and getting work done, if interested.', 'Thank you very much!', 'Followed and downloaded!! Thanks a bunch..', 'Hey man, I dig the playlist! I just dropped a track that I think fits the vibe. I would love to know what you think!\n\n[https://open.spotify.com/track/5GAtquT3ccm7JTZWQfWOTo?si=gxlgrPKeTwy7fHJyR1VNRg](https://open.spotify.com/track/5GAtquT3ccm7JTZWQfWOTo?si=gxlgrPKeTwy7fHJyR1VNRg)\n\nBest,\n\nSweeps', '[deleted]']",14,3.667022810255488,spotify
"so im starting to write some songs and made this playlist as a kinda moodboard, real like pop chill pretty stuff",,['Cool curation! Can I do a song suggestion?'],2,3.6791871621183776,spotify
Post your best playlist but describe which setting/situation or mood/feeling it best fits,"This playlist is called ""Morning Blend"". I made this for back to back party days at the cottage. Specifically, for the morning of the second day when you need to transition to a more chill vibe while keeping a good tempo and feel-good sound. It helps you blend into the second party day and you switch it when you're ready to dive into day 2. Enjoy.

[https://open.spotify.com/playlist/0r3VfOB6xHrhHBO3lLqDLo?si=yy\_MKITGRO2sJxTlM5m8LQ](https://open.spotify.com/playlist/0r3VfOB6xHrhHBO3lLqDLo?si=yy_MKITGRO2sJxTlM5m8LQ)","[""I am working on one called PISTOL MUSIC.   \nIt's basically a collection of songs that go HARD. In any genre: rap, metalcore, rock, etc  \n[https://open.spotify.com/playlist/3W80DzvzwN2ZY3kzNqKCPB?si=9cQYt3\\_PS82yizbrx4GdLw](https://open.spotify.com/playlist/3W80DzvzwN2ZY3kzNqKCPB?si=9cQYt3_PS82yizbrx4GdLw)"", 'I’ve always liked [this one](https://open.spotify.com/user/12136633909/playlist/6KVpGX5arsET1BkIz1uM5x?si=O41_Nhf9RLmPXZVeqPeRoA), The Road. For me it’s always been a sort parallel “the road” of life. Most of the songs tell a story or fit a particular vibe, but I do try to add variety to it. Dark, grungy, southern gothic vibe with sprinkles of jazz, rockabilly and class. Good road trip playlist.', ""Walking back from the bar not completely there. The rain pelting the empty streets as you turn down a dark soaked alley way. Your brain ticking away at the suspects alibis . Who could be behind the killings that ended not only your wife's life but many others lives too? You suck at your cigarette.  \n[https://open.spotify.com/playlist/63sb6IUtSuU3w3loMb6GHN?si=Zq\\_LRQcnTNS\\_HEDYCTgo4w](https://open.spotify.com/playlist/63sb6IUtSuU3w3loMb6GHN?si=Zq_LRQcnTNS_HEDYCTgo4w)"", 'My go-to playlist is called ‘space cadet,’ which I made largely during my junior year of college when I was almost constantly blitzed with at least two drugs in my system. I don’t necessarily condone this behavior, but I like this playlist because it is comprised of songs that make me feel either introspective or aloof, energetic or depressed, and contains a variety of genres and emotions. I find I listen to most often on my best and worst mental health days. [bump it](https://open.spotify.com/user/ryansafari/playlist/0kekTaHjGJiABKzLmOtgT1?si=PkRyvA_aQwS0mG4NKbLRiA)', ""This is a playlist that's very personal to me, but it still works okay for other people. These are songs that make me feel any strong emotion, sad or happy. There's a few shitty modern rap songs, but they hype me up, so they're allowed here. Anything goes, as long as i can feel it bone deep.\nhttps://open.spotify.com/playlist/40eAguGEux3WfHPXnL37E6?si=Ib6cKcRdS7yIK5PBqBke1Q""]",8,3.7420575325798104,spotify
"I've added onto my ""Roadtrip bangers"" playlist over several months. It's got a bit of everything in it. Enjoy countless hours of my favorite tracks!",,['Cool curation! Can I do a song suggestion?'],1,3.7534001252441493,spotify
"Indie 50 - A playlist for the highs, lows, and adventures in between.",,0,0,3.757161699326502,spotify
"Spotify changed how the search bar works on my Liked Songs, maybe also on other playlist","Searching then tapping shuffle play or choosing a song from the results doesn't filter out other songs that are not included in the results anymore. I always searched Taylor Swift on my Liked Songs so that when I shuffle play, Spotify will only play songs that has Taylor Swift in it, but now it's changed is still plays the whole Liked Songs",0,0,3.7638167922695476,spotify
An underrated classic gem that deserves to be listened to!,,['Cool curation! Can I do a song suggestion?'],2,3.785576051597794,spotify
Back to Spotify..,"I just switched back from god awful Tidal after a year, and I gotta say this new UI makes me want to yank my eyes out of their sockets. Everything is.. so, big. Especially the buttons at the bottom. It's a huge eye sore. I thought the old UI was not good but now I'd do anything to get it back.

I thought the new UI was only for free users but wow was I disappointed when it never changed.",0,0,3.850749662766854,spotify
Why is Spotify so damn glitchy on Android/Galaxy phone?,"Seriously half the time I use it nothing loads. I can't believe how **** one of the most popular music platforms is on Android.  Any ways to fix it?

Thanks",['Its fine on my Galaxy did you reinstall it?'],2,3.8527751257988037,spotify
For the road. Enjoy,,[' Cool curation! Can I do a song suggestion?'],3,3.874349199941865,spotify
Triphop Orchestra,,0,0,3.88857373698994,spotify
"I’ve been curating this playlist for those who want to discover whats trending in the UNDERGROUND Hip-Hop scene! Always Updated Regularly, Culture is home to amazing unsigned artists and open to submissions❗️ Hope You Enjoy It‼️",,"['I love the selection, bro! How does one submit?', 'Cool curation! Can I do a song suggestion?', 'Like all the other question how do u submit !']",6,3.909488088852829,spotify
..,Nothing like going through a depressed mood so you listen to music to feel better only to have ads ruin it and put you back to a depressed mood again.,0,0,3.9104718851601636,spotify
Do incognito streams count to your account?,When streaming incognito will it count towards the artist's stream,0,0,3.9853561444194225,spotify
CHILL EDM Playlist,"[https://open.spotify.com/playlist/00EOQlqf7dfh8vcJeLQYTJ?si=QJPXukf9Qfa95Wabp24rxg](https://open.spotify.com/playlist/00EOQlqf7dfh8vcJeLQYTJ?si=QJPXukf9Qfa95Wabp24rxg)

&#x200B;

check it out. This is edm that you can lay down/ feel good/ work in. EDM has changed my life and i'd love to share the magic with others!","['Really enjoying this playlist, thanks for taking the time to share it.', 'Cool curation! Can I do a song suggestion?']",5,3.9953792925813687,spotify
It’s too difficult to put local files on a phone,"I’ve done all the ways to get my local files from my PC onto my phone. I’ve reinstalled the app, used a hotspot, disabled firewalls, made available offline, etc. they still won’t appear on my phone. I don’t know why this process is so difficult.","['I have local files on my phone, what exactly is not working for you? Maybe I can help.', 'It just started working for me. I don’t know if this will help you, but running Spotify as administrator on my pc after reinstalling the app on my phone and downloading the songs again made it work. It’s really annoying how complicated it is.', 'Dude I’m literally exactly in your shoes. I have like two dozen local file playlists on my computer that won’t sync to my phone']",5,4.002485774062849,spotify
All Out 80s,,0,0,4.003828366782378,spotify
Can you change your Spotify password if it’s linked to your Facebook?,My Spotify account is currently linked to my Facebook and I don’t know if you can change it if it is. Can you?,"[""No you'll have to Change your password for Facebook to do it and if you wanted to unlike Facebook you'll lose your whole account I've tried before and found out you'll have to do a whole new account that's not linked with Facebook to Spotify""]",1,4.006548274247735,spotify
"Chill Synth Music | Synthwave, Chillwave, Synthpop, Retrowave, Vaporwave",,"[""Nice playlist! If you're open to a retro/chillwave track-\n\nhttps://open.spotify.com/track/2pDgjKdFZFzjsyH6hKlf62?si=dN6eOTobQnqMjQKsQ_Qkew\n\nThanks"", 'Cool curation! Can I do a song suggestion?']",4,4.020390866898277,spotify
"FireDance - Powerful instrumentals plylist ! No more laid back tracks for sleep and dreams, here are dramatic, energetic and vibrant tracks form brilliant musicians all over the world!",,0,0,4.026756607765953,spotify
"My account email was changed to a ""@sogetthis.com"" email (internal testing mistake)","I believe that my account email was changed to a @sogetthis.com email because of some kind of internal mistake at spotify. I quick search suggests that sogetthis is an alternate domain for mailinator which is for software testing.

Curious if this happened to anyone else.",['It seems more likely you were hacked which is pretty common with Spotify accounts. Contact Spotify if you need help regaining access to your account.'],1,4.029893181897975,spotify
Listen to the best Pop & Indie music in this Spotify playlist.,,0,0,4.031513552326295,spotify
Recently Played Troubles,"A few weeks ago I noticed someone was listening to some foreign music on spotify, coming from a device that is not mine. I kicked off all devices and changed my password. The problem now is that this persons music is stuck showing on my recently played music on my home page and nothing I listen to changes it or removes it. It's extremely frustrating! anyway to get this update or change since I am unable to manually delete?",0,0,4.0380066079398,spotify
Country Music | Classics & Covers,,0,0,4.047427904340956,spotify
Classic Road Trip Songs | Best Classic Rock Songs & Slow Rock Music,,['Gotta add the Doobie Brothers - Rockin down the Highway'],1,4.051594571062812,spotify
A beautiful and inspiring collection of modern and traditional classical string only tracks. Carefully curated for your listening pleasure.,,"['Excellent playlist thanks. Been wanting to explore more stuff similar to Hildur Guonadottir and Max Ritcher', ""Coming back to comment here. You've got excellent taste! I'm listening as we speak!""]",6,4.053145497049447,spotify
I just accidentally removed 900 songs from my “liked songs” library. Is there anyway to recover?,"Like I said I accidentally removed them. I was attempting to make a playlist of which I could share with friends where I accidentally click the wrong button, and *poof* they vanished. However, it should be noted that before I did this, I downloaded all of them since I have premium. Is there anyway to recover them?","['If you reach out to Spotify customer service they can restore you account to the way it was on a previous day. Just went through something similar, go.']",1,4.06346957117871,spotify
Spotify thinks I am in LA?,"Hey everyone, 

I love the Daily Drive podcast and for some reason, this week Spotify has set my playlist to be local to LA? So instead of NPR news now I get CBSLA the rundown. Very strange, anybody experiencing something similar? Trying to get it back to the NPR bit at the beginning.",['Here’s a pic:\nhttps://i.imgur.com/jAAmER5.jpg'],2,4.0688746638872,spotify
fire upbeat indie to get you right,,0,0,4.080784386170132,spotify
Spotify closing out on Chromebook,"Alright so...

I'm using an Acer Chromebook from about 2 years ago and recently downloaded Spotify. It's great and I'm really enjoying the app, but whenever I try to open Discord, or google, or any other apps, Spotify just closes. I tried split-screening the apps, but it closes after about 5 minutes. It's getting really annoying and I've tried to restart my Chromebook and run a developer debug on it, but things aren't working. Please help ;--;",['Use Spotify Web player instead of the app'],2,4.084302904735561,spotify
"Blend of electronic, alternative, beats, ambient and experimental. New records only. Multiple updates every week.",,0,0,4.108874664061047,spotify
Google mini home,"So I’ve had premium for years. I just found out about this free google home. So I google it and go through the motions. Connect my account etc. 

I get to the page where I pick a color and there’s 4 options and they all say 0$ underneath. I pick my color and proceed to checkout. Now it’s asking for 50$ and a small fee of taxes. What’s up!!?","['FYI the chat agent said black is no longer free. I changed the color to chalk and the discount was applied.', 'I just ordered the black one for free.', ""Got that email too. I wanted black but the discount didn't work.\n\nChamged it to silver and sure enough enough it should the $49 deduction.\n\nIm excited!"", 'Do you need a google Spotify account for this? My premium is through my yahoo email', 'It doesn’t actually charge you. I think the next page is a review of the order and the discount is applied. Just got mine in the mail today. Pretty loud for such a small speaker. A little lacking in bass but clarity is nice compared to the Logitech X100 I have.']",12,4.118226516296466,spotify
"LoFi Top 50 | Sad | Nostalgic | Vibey, a playlist by lexamsic on Spotify",,0,0,4.122346886746861,spotify
"Micro House Music, over 400 Records!",,0,0,4.132508923830809,spotify
Why Can't I Edit My Profile?,"I'm trying to edit the profile for my old Spotify account. The account is linked to my sisters Facebook account but she jumped to Apple Music so now the account is dormant. I'm trying to switch it over to my Facebook but I cannot. I followed the instructions on how to unlink it with your Facebook but when I go to the social settings there is no option to do anything related to Facebook. Likewise, when I log into the account page in an attempt to change the email address, there is no way to do so. Am I just stupid?",0,0,4.137879294259128,spotify
Spotify wouldn't start?,"I have tried like 10 times installing both from the installer(available from the website) and windows 10 store but it always shows the same error ""DSOUND.dll"" not found, please re-install. I went to their forums and tried the regsvr32 method but it didnt work out the windows store one, after starting up shows ""failed to migrate data"" and then the dsound.dll error. I have never downloaded any kind of 3rd party dll and spotify was working perfectly fine until one day when the app just stopped starting at all and i had to reinstall, which led me to the dsound.dll error. 

Any kind of help would be greatly appreciated :)",0,0,4.175286701771396,spotify
Depressed,,0,0,4.178099201829345,spotify
"House Of Grooves 2019-44 - Playlist #212 - Celebrating Soulful House, Deep House, Funk, 80s Boogie, Disco, Rare Grooves and Jazz flavours: http://soulfulgoodness.blogspot.no/",,['Cool curation! Can I do a song suggestion?'],1,4.197821424109517,spotify
Perks of Spotify Subscription AKA what free stuff am I missing out on?,"So I recently found out from a friend the whole free google home mini if you are a Spotify subscriber, I signed up for the free hulu add on when that was out, are there any other perks I am not taking advantage of yet?",['Wow thank you for this.  I just ordered my free google home. I have honestly been wanting one just to be able to play my spotify whenever I want and to be able to control it with voice commands. \n\nSo thankful!!!'],2,4.1978677204610015,spotify
Fire rap playlist for jamming with buddies or when you’re high 🔥give it a follow if you like it!,,['PM me if you have any song suggestions!'],1,4.199661702058381,spotify
Top 50 Anime Openings(Ranker.com),[Top Anime OPs](https://open.spotify.com/user/karim.hamdan9746/playlist/02wJVDwKN1qyEgyIfdaBES) Playlist of 50 great anime openings. Let me know what you think about it.,0,0,4.222566794711683,spotify
Why I can't disable canvas?,"When i turn off canvas and  start any song this option is turning on, i can't change it. I have got Premium on android 9. How to disable this annoying videos?","[""Same here. I'll let you know if I find how to disable it""]",2,4.239661702163242,spotify
Is there a way to move local files to like songs?,"I have a couple songs that I want to move and have looked elsewhere but not really found an answer. If it matters, I have Spotify Premium and use a Macbook and Iphone with the latest version of Spotify installed",[],1,4.240992720753506,spotify
90's Songs | Top 💯 90s Music Hits,,0,0,4.261328369003755,spotify
"Best Songs of 1989. The apex year of British rave culture, a stone-classic year for hip-hop and albums of profane poetry",,0,0,4.262022813508907,spotify
80's Songs | Top 💯 80s Music Hits,,0,0,4.262045961701208,spotify
70's Songs | Top 💯 70s Music Hits,,0,0,4.262254295106287,spotify
60's Songs | Top 💯 60s Music Hits,,0,0,4.263064480393573,spotify
"Drift away with a beautiful mix of new age, ambient, and neo classical music with the Streaming for Dreaming playlist 🌙",,['Love it. Thank you!'],2,4.275969573044114,spotify
Melodic rap playlist full of hypnotic melodies and out of this world beats. Great for night time smoke sessions alone or with friends.,,"[""Greetings! I have a few new tracks that may fit your playlist. I'd appreciate if you take a listen when you have a moment. Thank you in\xa0advance.\n\nHere's the Spotify links\n\n[https://open.spotify.com/track/3Npf6J5ANSrGwcRlz0yGCz](https://open.spotify.com/track/3Npf6J5ANSrGwcRlz0yGCz)\n\n[https://open.spotify.com/track/2YJjctEzQErO6bL0TLCYDR](https://open.spotify.com/track/2YJjctEzQErO6bL0TLCYDR)"", 'Cool your welcome.']",5,4.284383924942877,spotify
What to choose? Spotify or Deezer?,,"[""Probably the one that you find to be the best for you is my guess. \n\nI do love the flow feature but that's about it. \n\nSo I currently use Spotify.""]",1,4.293226517717596,spotify
"16+ hours of Relaxing Instrumental Music for studying, relaxing, concentration, sleep. No drums, no vocals but plenty of acoustic guitars, piano, all sorts of relaxing instrumentals from some great independent musicians from around the world playing for your enjoyment. [Spotify] {playlist}",,0,0,4.29815707333386,spotify
Official Big Mouth Netflix Soundtrack!,,0,0,4.325518184491882,spotify
"Utopia: A playlist of chiller electronic tunes perfect for kicking back and getting through another week. Think artists like ODESZA, Tycho, Kasbo , and many many more",,"[""Awesome playlist. Lot of great names on here. If you're looking for new tracks to add here's one I think would fit really well! https://open.spotify.com/track/1m4cVAp03i2RzyF2EdAHOz?si=OVfG2SyKTqedVwrM1AlSfA""]",2,4.325761240116424,spotify
It is unreal how good Spotify are at recommending new songs!,,"['Its simple yet effective.  Spotify ""takes notes"" of thousands of users having similar taste, sees what are their favorite songs. Then recommends one\'s favorite to another. \n\nSay there are 5 users who have similar taste. \n\nUser A loves songs a,d,p,t,e\n\nUser B loves songs s,x,d,v,t\n\nUser C loves songs x,a,p,f,e\n\n.... and so on.\n\nSpotify\'s algorithm will mix and match this data, and User A will discover an awesome track, say x, on his ""Discover Weekly"" someday.']",2,4.329580684861652,spotify
"Supernatural! The complete playlist of this tv show (s1-15). Will be updated with every episode... A lot of great rock classics, metal classics, blues and soul",,0,0,4.357393184930638,spotify
