title,body,coms,num_coms,age,subreddit
How to listen song's summary in 10 seconds?,"Hi , I have a playlist over 2000+ music and like to go back now and clean it up a bit. I remember web version had option where you could listen to song summary in 10 seconds. They discontinued that future right? I need something like that preferably over pc or phone so I can go over thousands of songs quickly. Thanks.",['https://discoverquickly.com/'],2,9.371409392326518,spotify
Account hacked Hulu lost,"My account was hacked and they changed my account from premium to family.  Got in touch with Spotify changed it back but Spotify said because they changed my account my Hulu bundle is gone.  Sucks, Hulu is cheap but that bundle was a good deal.","[""You weren't hacked. The same thing happened on my account and others. Spotify is being shady and we need to make this known. Contact their support and ask them to tell you who logged in (IP address) to your account and made the upgrade. They'll just keep telling you it's not possible. Which is obviously wrong. We all know about how much data these companies like to keep on us.""]",1,9.386282077522742,spotify
Request - Playlist to listen in the car,"Songs like rebel yell - billy idol, david bowie im deranged and kavinsky nightcall. Can someone provide me a playlist of such songs? Thanks in advance","['[https://open.spotify.com/user/donald-maccuish/playlist/3xh6cgXOrMTpmTxquxJN2c?si=vUOblTXESPu4TJKUg9DUYw](https://open.spotify.com/user/donald-maccuish/playlist/3xh6cgXOrMTpmTxquxJN2c?si=vUOblTXESPu4TJKUg9DUYw)', 'Post this in r/ifyoulikeblank you’ll get a better response', 'You could also try the Spotify Stations app and play songs like those.']",4,9.403793651607852,spotify
Banjo Picking: Instrumental tunes featuring banjo (from Bluegrass to Folk to Jazz to Blues and beyond...!),,0,0,9.410483466422669,spotify
"Lost, Still Waiting to be Found Nearly 10 hours of music I've been collecting since 2013. Only under the radar artists, only excellent music. Any music lovers about?",,0,0,9.411293651621651,spotify
"Do you love instrumental rock? Here's a playlist of well know instrumental musicians like Joe Satriani, and Steve Vai, plus instrumental songs from well known progressive rock, and psychedelic rock bands like Camel, and Pink Floyd, as well as some more obscure bands.",,0,0,9.419939484966022,spotify
Love Songs 80s 90s | Best Romantic Songs in English [Pop Rock] {Playlist},,0,0,9.450599207188244,spotify
Love Songs 60s 70s | Best Romantic Songs in English,,0,0,9.454164022014098,spotify
Throwback Thursday playlist,"Does anyone have an mirror of the throwback thursday playlist from last week? It was full of Euro dance tunes. I was supposed to save it before it changed today, but completely forgot.","[""I like an idiot forgot to copy that list too. I'm hoping someone grabbed it.\n\n\\*edit\\* I did find this list, but its not everything. [https://open.spotify.com/playlist/67Cw7fpE1UKSCsg7Vqjscy](https://open.spotify.com/playlist/67Cw7fpE1UKSCsg7Vqjscy)?""]",2,9.455587633125209,spotify
Deep and Tech House,,"[""Greetings! I’m a producer from Los Angeles and I have a few tracks that may fit your playlist. I'd appreciate if you take a listen when you have a moment. Thank you in\xa0advance.\n\nHere's the Spotify links\n\n[https://open.spotify.com/track/0KBp4HPqDkmCMiLilZ06NF](https://open.spotify.com/track/0KBp4HPqDkmCMiLilZ06NF)\n\n[https://open.spotify.com/track/1dxPiMZUQfqAgJoKkpP9QY](https://open.spotify.com/track/1dxPiMZUQfqAgJoKkpP9QY)""]",3,9.456444114620487,spotify
Playing Spotify on a different phone?,"Hi everyone!

  


So I currently use an Android phone, and am considering airpods. I have a spare iPhone and was planning on just shoving that in my backpack while I go to work and using Spotify on my main phone to play music from my iPhone.

Does anyone here know if that's possible? Id like to know before purchasing airpods.","[""Just download the Spotify app onto your iPhone.  As long as you are only playing Spotify from one device at a time it shouldn't be a problem.""]",1,9.456802910927822,spotify
"My pick of the latest Electro updated with Ectomorph, Lost Trax, Freedom Engine, Conforce, Mesak & 214 on Interdimensional Transmissions, Frustrated Funk, fabric, Delsin, Forms & Figures, Dekmantel & more",,0,0,9.46631679981671,spotify
Can't cast to chromecast and g. Home mini. It's just Spotify. Anyone else have this problem?,"I can't seems to understand why, but spotify won't play in my chromecast nor my Google home mini. Everything else will work, but with Spotify, if *I select* the device I want to cast to, I can't.",0,0,9.488191799824989,spotify
Beachwalk problems,"So I'm listening to a vaporwave playlist, I play it in the mornings while I ride the bus and for some reason every song works. This is the only song that has ever done this, but whenever Beachwalk - Zen Remix by Whitewoods comes on it'll play up to 0:21 then just stop playing. It won't pause, it'll act like it's loading.

And if I close out of the app and open it up again it'll play a single second of it more then do it again, and it's only this song. If I skip to the next song it works perfectly loads all the way and I have no issues",0,0,9.496224207232396,spotify
"KILLED❌CONSUMERS][][][, a playlist displaying more of todays most underrated hip-hop artists. Happy Halloween! [Order Matters]",,0,0,9.506004299836025,spotify
Spotify Kids - A new standalone app for kids/Spotify family,,0,0,9.508122355405378,spotify
"Sit Back and Relax - Soothing and relaxing collection of instrumental music for reading, studying, sleeping, concentration- No vocals, no drums - All independent artists - Updated weekly- Suggestions are welcome",,"[""Greetings! My name is Trell Daniels and I have a few tracks that may fit your playlist. I'd appreciate if you take a listen when you have a moment. Thank you in\xa0advance.\n\nHere's the Spotify links  \n[https://open.spotify.com/track/3Npf6J5ANSrGwcRlz0yGCz](https://open.spotify.com/track/3Npf6J5ANSrGwcRlz0yGCz)  \n[https://open.spotify.com/track/2YJjctEzQErO6bL0TLCYDR](https://open.spotify.com/track/2YJjctEzQErO6bL0TLCYDR)""]",1,9.52247420725723,spotify
"“Odd Meter Songs and Instrumentals” the biggest of its kind on Spotify. from Stravinsky’s Rite of Spring to the latest TOOL album and everything in between... a feast of odd meter, shifting rhythms and unusual time signatures. rock, world music, jazz, alternative, progressive, acoustic, classical",,0,0,9.549152448009009,spotify
Instrumental Christmas Background / Holiday / Seasonal / Feliz Navidad music,,0,0,9.559129299860862,spotify
Daily mixes vanished from phone??,Idk why but for the second day now it just refuses to show on my phone despite it still being there on my laptop. I've already done all the standard stuff of logging out and reinstalling but still no luck.,"['It shows on my phone but they’ve all been made to be shuffle only\n\nPisses me off', 'This happened to me on laptop, iPad and iPhone. I loved these and hate that I also lost “release radar” and “discover weekly”. Those two hurt the most for me', ""Update: it's back. That was quick""]",4,9.561363096168195,spotify
MTV's 120 Minutes 1993. All the songs (available on Spotify) that have been played on the show in 1993!,,0,0,9.575240411007846,spotify
"[PLAYLIST] My first one, for chilling",,0,0,9.58068022582266,spotify
Who else loves relaxing guitar music? Here is a spotify playlist with my favorite calming instrumental pieces performed on classical or acoustic guitar. Updated weekly with new releases.,,['You might want to add this in there! [https://open.spotify.com/track/4M5jEJ036Gn9NWiLgWdf9w?si=VRzFapchRauMalcNChrTOQ](https://open.spotify.com/track/4M5jEJ036Gn9NWiLgWdf9w?si=VRzFapchRauMalcNChrTOQ)'],5,9.582995040648512,spotify
Spotify Quality of Life,"Can we get a ""quality of life"" update? I feel like there are so many little things that would make Spotify so much better. Like, real-time lyrics, hotkey to add songs to queue/certain playlist (on desktop), also the friend activity thing is total bs. There is almost no point to it, they should make it where you can share songs with your Spotify friends. If you have any more ideas, comment them below.","['They should suggest usermade playlists to you. A playlist that matches your musictaste the most to other users. (same liked songs etc)', ""I used Apple Music for a couple of years after it first came out, but then switched to Spotify about 2 years ago because I vastly preferred its music discovery capabilities. I recently did a free 6-month trial of Apple Music. \n\nOverall, I still prefer Spotify. Music discovery and playlists are still superior and I LOVE the cross-platform support. I would really miss the Spotify Connect feature that I use to connect to and control music on my Alexa devices (which we have throughout our house and use heavily). \n\nBut these are the things I still really want to see in Spotify: \n\n\\- A light mode setting. Really, I want this so much. I use Spotify outside a lot and the dark UI makes it really hard to see. I love the ability to switch between light and dark mode in Apple Music based on the system setting. \n\n\\- Live lyrics. I HATE how Spotify does lyrics for (some) songs. I love how it's done in Apple Music. I like being able to see lyrics and want them in the app (I do use MusixMatch, but hate that I have to go to a different app to see them)\n\n\\- Please give me the ability to turn off podcasts. I listen to podcasts in a separate app and don't want to see them in Spotify. This should be a simple thing that users can toggle on/off to suit their preferences. \n\n\\- Better library management. PLEASE! This is the one area where Apple Music really shines and Spotify has done a lot of make library management even worse over the past year. They need to fix this. \n\n\\- Finally, recognize that many people (like myself) are almost never accessing Spotify via a PC. Right now, there are a couple of things you can ONLY do via the desktop app (such as re-arranging the order of playlists). This capability should be available on the mobile apps.""]",4,9.598168651770662,spotify
Jazz Noir & Cinematic. A few of my favorite songs that I think fit perfectly with the abovementioned genres.,,0,0,9.600900133252145,spotify
I wish spotify had a completly random play feature.,Like I'd just press it and it started playing a bunch of randomly selected songs from the entire spotify database.,"['This playlist has 1000 songs randomly selected from the whole Spotify catalog, updated daily.\n\n[https://open.spotify.com/playlist/26joDQXjEVcvfFQuUhLzTY?si=\\_daJY9\\_6QAuWOkVfq1C1Zg](https://open.spotify.com/playlist/26joDQXjEVcvfFQuUhLzTY?si=_daJY9_6QAuWOkVfq1C1Zg)', ""If not by genre or something why? \n\nI feel you like you're underestimating the amount of shitty music."", ""That's how Apple Music's recommended songs work"", '[Shuffle All The Songs](http://shuffleallthesongs.com/) lets you put all of Spotify on Shuffle. For the less daring, you can restrict the shuffled songs to a set of genres, decades and/or popularity. (Created by [@plamere](https://twitter.com/plamere))', '[Daily Random](https://open.spotify.com/playlist/6p21dRudS9FmcyGvKWPq2R) is another playlist that chooses 30 random songs from all of Spotify each day.', 'Additionally, i want a random movie button in goddamn IMDB', 'This feature exist on Discover Quickly.\n\nHere you can choose a random artist, a random genre or a random song.', ""This playlist is the top 10,000 songs of the week (based on artist popularity). Refreshed every Friday with the week's new releases.\n\n[https://open.spotify.com/playlist/3xvkKvl17gx5DAULZNcUED?si=-GEi4kKGSuGoiE8uxOO0HA](https://open.spotify.com/playlist/3xvkKvl17gx5DAULZNcUED?si=-GEi4kKGSuGoiE8uxOO0HA)"", 'you and everybody else', ""Wouldn't you have trouble with the ambient noise songs like rain and animal noises? Plus the meditation and hypnotic stuff that is used like solely to fall asleep to. Might need a minor filter. Spotify thinks A Lot is music."", 'Honestly, any one of my daily mixes can provide you with that. They are horrific lately.', ""This playlist might work for you: https://open.spotify.com/playlist/69fEt9DN5r4JQATi52sRtq?si=4rn2xwNtTj6iHo9uFx62ZA\n\nIt's from http://everynoise.com/, which automatically builds playlist for every musical genre it tracks. The playlist I linked puts one popular song for each genre in it."", 'forgotify dot com plays you random tracks that have 0 plays', ""I'd love something like that too, but I think to randomly pick a selection of songs from 30 million of them would take some serious chutzpah"", 'Its called Pandora.', 'I would like this, but for all my own songs. I don\'t understand why there isn\'t an ""All songs"" section. Liked Songs means I have to individually add each song of each album I like. So dumb.', 'That needs to happen', 'Try Spotify Stations app', ""I wish spotify's regular features would work""]",75,9.67404828141409,spotify
[Hip/Hop Music] Clean the house playlist,,0,0,9.69709226289557,spotify
Socialize and mingle. Music for a vibrant and exciting ambience.,,0,0,9.697497355496441,spotify
Why did The Cure remove Pornography and other songs from Spotify,"Pornography is one of my favourite albums by The Cure, and the removal of it made me upset. Does anyone know why this happened?",['The title of the album maybe? I could be wrong buts a guess'],1,9.708539022174147,spotify
Does anyone know why Spotify didn't pay this October?,,"['I was paid 10/26 for August (2 month lag is typical for us)', 'The two months before that I got paid from Spotify on September 28 and August 24', 'Checked support and they have an announcement on their support Bot\n\n“The July royalty reports should be added to your CD baby account in a few weeks.  We apologize for the delay“']",7,9.750969577729702,spotify
Has the reverse typing bug solved yet?,Pretty sure I’m not the only one who constantly has to retype text automatically typed backward on Spotify search?,0,0,9.773492725891648,spotify
New Streaming Platform Paying us 5x more than Spotify,"We are a small electronic label that just put our catalog on the streaming platform Emanate. They haven't fully launched yet, but so far we are making much larger returns on streams than years operating off of other platforms like Spotify. It is built off of cryptocurrency payouts for streams that get converted by Emanate into real money for artists. This is honestly really promising for us who have been grinding on music production and getting pennies in return. I'm curious what everyone here thinks. 

This is a short article about us adding our music to the platform, but check out the link to Emanate at the bottom. 

[https://medium.com/emanate-live/postseason-franchise-records-9571f5236433](https://medium.com/emanate-live/postseason-franchise-records-9571f5236433)","[""If they are paying more than Spotify, who operates at a loss, then I don't expect someone paying more to be viable."", 'spotify didnt pay me this month...whats up with that?', 'It’s an entirely different business model. Just look up Emanate.io \n\nPlus, Spotify reported being profitable in February.']",4,9.809511244421204,spotify
"Synth Music with Male Vocalist | Synthwave, Darkwave, Retrowave, French House",,0,0,9.832821429617427,spotify
Why do random artists and songs keep appearing in my recently played?,"What the title says pretty much, also followed a bunch of random artist that don't even exist. 

Have changed all my passwords multiple times and it keeps happening. Sometimes it'll change the song and say playing in web player chrome when I'm listening on my phone!!","[""On top of changing your password, you also need to force all devices to log out via Spotify settings (web browser). You might also want to take a look over any trusted apps/services to see if there's something you don't recognize or trust in there.\n\nYou can also download a log of your account activity - might be worth doing that too if you wanted to look over things.""]",2,9.870055225913724,spotify
"{Playlist} A Spotify playlist with good vibes with a tribute to love and self respect [Hip Hop, RnB, Rock, Indie pop, Funk, Disco, Indie Rock, Folk]",,"[' \n\n1. Boards of Canada - Olson\n2. Frank Ocean - Nights\n3. Kendrick Lamar - Sherane a.k.a Master Splinter’s Daughter\n4. Childish Gambino - Me and Your Mama\n5. Tame Impala - The Less i know the better\n6. Modest Mouse - Float on\n7. Audioslave - Like a stone\n8. Ned Doheny - Get it up for love\n9. Frank Sinatra - That’s Life\n10. The Coral - Dreaming of you\n11. Boat Club - All the time\n12. Supertramp - Oh Darling\n13. The Jones Girls - Nights over Egypt\n14. Urban Species - Listen\n15. MØ - Never Wanna Know\n16. Chaka Khan, Lew Hahn - Some Love\n17. C.V. JØrgensen - Bellevue\n18. Grateful Dead - Franklin’s Tower\n19. Robert Palmer - Every Kinda People\n20. Gerry Raferty - Get it Right next time\n21. Gil Scott-Heron - I Think I’ll Call It Morning\n22. Mac Miller - What’s the Use?\n23. Guru, N’Dea Davenport - When You’re Near\n24. Mac DeMarco - On The Level\n25. Delegation - Oh Honey\n26. BJ The Chicago Kid, Anderson.Paak - Feel The Vibe\n27. Toro y Moi - Mirage', ""For the intended listening experience, play songs in order since i've put effort into the flow! Enjoy!""]",2,9.961293651850687,spotify
Is there a way to keep the iphone screen from auto-locking while playing music?,"I just updated the app. The screen used to stay awake like gps apps do, but now it sleeps according to the iphone auto-lock timeout. My phone is my car stereo, so this makes using Spotify very difficult. 

I saw an old thread on this and it didn't seem like it was resolved. Any way to keep the screen on while in the Spotify app without disabling the auto-lock entirely system-wide and without using a gps app to change songs?",['Nope :/ it really bugs me too that they changed that'],2,9.96283300370254,spotify
Eletronic carnival!,,"[""There's actually some really great tropical house in here! Cheers"", ""Greetings! I’m a producer from Los Angeles and I have a few tracks that may fit your playlist. I'd appreciate if you take a listen when you have a moment. Thank you in\xa0advance.\n\nHere's the Spotify links\n\n[https://open.spotify.com/track/0KBp4HPqDkmCMiLilZ06NF](https://open.spotify.com/track/0KBp4HPqDkmCMiLilZ06NF)\n\n[https://open.spotify.com/track/1dxPiMZUQfqAgJoKkpP9QY](https://open.spotify.com/track/1dxPiMZUQfqAgJoKkpP9QY)""]",2,9.969013559271891,spotify
This is Halloween,,0,0,9.970471892616263,spotify
This is Halloween by Playlist Heroes,"[This is Halloween](https://open.spotify.com/user/playlistheroes/playlist/4dbhUMpP8ziPQBTw9QVb24?si=nUv466krTrS5WmR_R1wrvA)

Scary scores, terrifying tunes, mystical melodies and spooky songs...this is halloween!",0,0,9.973920966690336,spotify
"{Playlist} Good vibes with a tribute to love and self respect [Hip Hop, RnB, Rock, Indie pop, Funk, Disco, Indie Rock, Folk]",,"[""For the intended listening experience, listen to the tracks in order since I've put effort into create a certain flow. Hope you enjoy it! :)""]",1,9.99018254077545,spotify
Backups of Spotify created Playlists?,"Hi, there is a playlist that got me through a few semesters of college with great songs. It is called [Study Zone by Spotify](https://open.spotify.com/playlist/37i9dQZF1DWSSrwtip3vZP). 

Unfortunately, they removed a lot of my favorite tracks for more recent ones. Some of them aren't that bad, but I miss the old set. 

I've checked Archive.org Wayback Machine, Google and Bing caches, and some others, but they either don't have it or only have the first 30 songs.

What options are there to possibly recover an older version of it? Do you guys have any suggestions?",0,0,10.001351522270728,spotify
Is there a way to follow friends without logging in to Facebook?,"I want to follow a couple of friends who also use Spotify, but I don't want to make a Facebook account to do so. Is there a way to follow them without making a Facebook account?",[],1,10.020668651900356,spotify
Electronica/Psy Dreamhouse by Liquid Lu C. New album on the way!☮️🎧☯️,,0,0,10.05400198524473,spotify
Apk for my personal fav spotify version,"https://spotify.en.uptodown.com/android/download/1898346

This is the version that sets the ui back to...
Library

-setting option in top right corner(not on home)

-songs tab: Whatever order you downloaded

-artists tab: will show whatever songs you have by 
them(not having to download full albums)

Option to turn off lyrics and canvassing. 

The other 8.5 versions are good but the NEED to have an entire album and a follow for an artist just to see what saved songs you had in your library was too annoying. I shouldn't have to download an entire album just to hear maybe one song >:(",0,0,10.056235781549304,spotify
"Melodic rap playlist, your goto spot for daily good vibes (JuiceWRLD, Nav, The Weeknd, Boogie, Post Malone ) -updated weekly",,0,0,10.075240411178934,spotify
Made a pretty concise Anthology of Punk Playlist for someone. Thought you all may appreciate it.,,"[""1. Stooges- This is Iggy Pop, grandfather of punk, and I like this song a lot.\n\n2. Ramones - Also grandfathers of punk, I'm sure you know them\n\n3. Clash - same story\n\n4. Sex Pistols - Same story.\xa0 They aren't very good IMHO, but iconic, and sid and nancy and all that.\n\n5. Sham 69- Lesser known than the previous.\xa0 British punk band, they were also sort of the start of Oi! which is a skinhead offshoot of punk.\xa0 Skinhead doesn't mean racist by the way. It was the style that came from the dock workers. Bob marley was a skinhead / rudeboy at one point.\n\n6. Cocksparrer - same story as above\n\n7. Buzzcocks - Same era, but more on the punk end.\xa0 Plus the song is hilarious.\n\n8. Cramps - Same era again, but they had more of a psychobilly flair as punk came into it's own and started splintering into different factions.\n\n**9. New York Dolls - I should have had them higher in the list for time, but another punk band, but they had more influence from glam rock.**\n\n10. Bad Brains - these guys were a huge deal, they were punk as fuck, started in 77, whereas 5-9 were all around 1974-1975.\xa0 They are american, and black dudes.\xa0 They were influenced by rastafarianism, and I think they were all vegans.\xa0 They were also kinda the godfathers of hardcore.\n\n11. Fear - Same era, punk with almost a country edge.\xa0\xa0\n\n12- Exploited - pure punk / gutter punk.\xa0 Shit music, but super popular.\n\n13. Subhumans - Pure punk / gutter punk, but much more intellectual and political.\n\n**14. Dead Kennedys - One of the best / most influential / most political punk bands ever.**\xa0\xa0\n\n15. DI - Super early 80s, hardcore punk.\xa0 Iconic, but maybe not great.\n\n**16- True sounds of liberty - TSOL - hardcore punk, but a grandfather of horror punk**\n\n**17. Black Flag - Super important band, Henry Rollins was the original frontman, he's a gem of a human.**\n\n18. Agent Orange - Another super wonderful band, and they actually had talent.\n\n19. Agnostic Front - Another early hardcore band. Very popular, very controversial.\n\n20. Misfits - THE horror punk band, everyone has their shirt. More melodic, Glenn Danzig also formed the metal band Danzig.\n\n21. Operation Ivy - The birth of skater / pop punk.\xa0 The members went on to form rancid.\n\n**22. Rancid - The first punk band that got a lot or radio play.**\n\n**23. Social Distortion - Super popular punk band with a country flair.\xa0 Mike ness is a big deal, just ask Steve.**\n\n24, Circle Jerks - another pure punk band that also helped form hardcore.\xa0 I like this song, it should have been earlier in the play list probably, this song was mid 80's\n\n**25. Descendants - Another of the first skater punk bands.\xa0 You've probably seen the shirts**\n\n**26. NoFX - super intelligent, irreverent, and political. Spanned decades, still touring.\xa0 Very much on the pop/skater end of punk.\xa0 Also, Fat Mike was in the movie Bad New Bears, which is funny.**\n\n27. The Vandals - Satirical skate punk band, lots of good stuff.\n\n28. Bad Religion - Older band, but continued success, and this was a later song of theirs.\xa0 Super duper smart people, and obviously a little anti-religion.\n\n**29. Dropkick Murphys- They are punk with some oi, and some hardcore, and a bit of boston/ irish flair.\xa0 Punk sorta turned into a San Francisco / Boston thing, and they are a boston band.\xa0 This was their first hit which was released on a hellcat records comp.\xa0 Mike McColgan left to become a firefighter, this was with him before Al Barr from the bruisers came in.**\n\n30. Pennywise - another super popular skate punk band\n\n**31. Bouncing souls - one of my favorite bands of all time, figure it was a good finish.**""]",1,10.089094577856638,spotify
"How do I get Spotify to stop adding songs to my playlists for no reason it “tHiNks I wILl liKE”, seriously, I just want to listen to my own songs not your shitty sponsored ones.",,"['Pay for premium.', 'Sorry but you can’t remove it, I too am annoyed by this. Unless if it was rhetorical question then I am sorry for answering.', 'Never happens to me.', ""If you're a premium user and find you're hearing extra songs after your playlist has ended, then you possibly have Autoplay on. You can switch it off in Settings.""]",6,10.089789022314879,spotify
"Ready for Halloween? Here is a playlist carefully crafted to capture the spooky vibe of 80s horror, thriller and sci-fi movies. A perfect listening experience if you want to go beyond the Stranger Things soundtrack. Genres like retrowave/synthwave and corresponding sub-genres (dark synth etc.).",,0,0,10.09052976305562,spotify
Throwback hip-hop gems,,0,0,10.10527513343703,spotify
