title,body,coms,num_coms,age,subreddit
"Melodic rap playlist, your goto spot for daily good vibes (Rich the Kidd, JuiceWRLD, Lil Skies, Future) -updated weekly",,0,0,0.017879263540660894,spotify
Southern Rock and American Rock,,0,0,0.019337597257561154,spotify
Spotify from Pandora,"How do I make awful songs go away! Such bad music. Oh, the stop sign. Whew!",0,0,0.02239315339260631,spotify
I literally can't find a way to listen to a full album in order and ininterrupted,"I have spotify free, so I can't really go that road. I tried using youtube once, but I swear never again, as there was an ad after *every single* song. There's no ""full album"" vid for it either, I've checked. What do I do? I guess I could download each song through youtube mp3 converter, but that would be a pain in the ass + really time consuming..","['uninterrupted*, sorry', 'You need Spotify premium to listen to albums in order and uninterrupted.']",5,0.03514778321815862,spotify
"Acoustic Guitar Attic - Beautiful acoustic instrumentals, from amazing guitarists - Updated weekly!",,0,0,0.04403667219811015,spotify
"A new, crappy library UI's look","Why, Spotify? Just. WHY?!! Why did they changed library UI?! I never got that and I still don't. This new library UI just looks like crap to me and many other Spoti's users and I hate it so much, like, SO. FREAKING. MUCH!!!! What happened to our great-looking library, and why this happened to it? Seriously guys, why the Spotify staff had to change something, that worked/looked awesome, for so much worse? This feature is the main reason I switched from Spotify to Tidal and cancelled my Spotify Premium subscription, because not only Tidal has MUCH BETTER HiFi sound quality, but it also has better library UI than Spotify has right now. Good job, spotify, you destroyed something that was awesome and now it's not because of YOU! Sorry, but they make no sense anymore. That's the truth. What are your opinions on the new library's UI?",['They really brought bac ‘recently played’ only to fucking remove it again ffs'],2,0.047404727963385754,spotify
I have problem getting Google Home Mini,"Recently, I bought the premium subscription with the student discount. Then, I tried to get the Google Home Mini but said that my account is ""not eligible"" for a Google Home Mini",0,0,0.05532139487288616,spotify
"Is there a way to save the ""Playlist Radio"" to a new playlist?","I get that it's generated, but it would be nice to be able to save f.e. the first 100 songs to a new playlist.  
Is this possible?",0,0,0.05628204352877758,spotify
"""Mellowhype"" - a rap playlist for when you want to bob your head, but don't want brain damage",,0,0,0.06299500665454952,spotify
"Hi everyone!! for all MCR fans, i just started to workout and i created a playlist only with MCR most ""punk"" or suitable for workout, i recommend to listen in order... tell me what you think!!",,0,0,0.06371259950101375,spotify
Collection of Synthwave/Darksynth and 80's Hits!,,0,0,0.06393250708502751,spotify
Anyone else have trouble installing the Spotify desktop app?,"I download the Spotifysetup.exe file and it gives me an error each time that says ""Windows cannot access the specified device, path, or file. You may not have the appropriate permissions to access the item.""

I am opening the file on an Admin account on a Windows 10 PC, and it looks like it isn't blocked by a firewall or anything.

I have tried installing it from the Microsoft Store and the same error message pops up, even after it's installed.

I have searched the internet/wiki and have yet to find a solution that works. Does anyone know how to bypass this?

UPDATE: C:\\Program Files\\WindowsApps folder is greyed out. Says admin/users have read-only permissions. Manually took ownership of all greyed out/read-only files. Still not working.",0,0,0.06834222946729925,spotify
"A playlist of random songs cobbled from my ""Recently Played"" section on the Home page",,"['1. This was from a day ago, when I experienced the ""redirects to Home page"" thing for the first time.\n2. All songs are the only that I exactly played during this period.\n3. Plus, the URL\'s frozen for me.']",1,0.07520565545117414,spotify
"The Culture Playlist is curated for those who want to discover the latest in the UNDERGROUND Hip-Hop scene❗️Updated regularly, Culture is home to amazing unsigned artists and open to submissions too❗️ Enjoy‼️",,['Kanye and famous dex in the first 4 lol very underground 10/10'],1,0.07608528514979063,spotify
"The one BIGGEST thing Spotify needs, IMO.. Playlist Control","The ability to take a pre-made playlist, whether Spotify or someone else, and turn it my own and be able to add/delete songs. Unless you can somehow so this already? This seems like a no-brainer. This all allow playlists to evolve and become more unique.","['That is a great idea. I would also love to see a similar feature in user-created playlists, where you can further customize it (""chill""/""upbeat"" mode in family mix for example) to only play a mix of certain songs in your respective playlist.', 'You can always copy and paste songs from someone else’s playlist into your own — and then add/delete songs from there.']",2,0.07851584082124409,spotify
Playlist full of rap/trap/hit-hop/grime mostly newer songs but classics too also featuring a lot of obscure artists from various countries to expand your horizons,,0,0,0.07989315563605891,spotify
Anyone had their spotify client randomly mute itself before?,"My spotify app on windows 10 (premium, uk) sometimes mutes itself while music is playing. It happens without any input from me at all, and i have no programs that should be able to interfere with it. Any ideas?",0,0,0.08926815564709681,spotify
I make Electronica/Psy Dreamhouse. New album ‘Falling Tabs’ drops in 2 weeks! I’d love for people to check out some of my recent work beforehand. Trying to gain some fans!😊,https://open.spotify.com/artist/7tmxjXIZQGLqicQyjn7TA8?si=n4CpmPCMQhaDYoN7Mhx5sA Also available on all major platforms✌🏻,0,0,0.12059917443328434,spotify
"6 Month Spotify code not working, and cannot log into Spotify Community","I know you guys aren't affiliated with spotify but i was still hoping i might be able to get some help here. I created a spotify account so i could use the free 6 month spotify code i got from the Xbox Game Pass, and when i try and redeem it it tells me ""It looks like you’re not eligible for that offer, but we found more for you."" and gives me a 3 month offer instead. When i tried to use the community forums to post my question and ask there it gives me the same error over and over again tells me to verify my email and says  ||${emailAddress}|| every time, despite reverifying my email. Does anyone have any advice to help me fix this?",0,0,0.13836537820873437,spotify
In my artists categories can I not delete songs?,Like lets say I wanna shuffle play all my queen songs it also shuffle plays songs I don't have liked. Is there a way to remove them?,0,0,0.16434917454918224,spotify
Deezer's flow in Spotify,Is there any option to autoplay songs related to your library like deezer's flow does. I just quit deezer a month ago to move to Spotify and already bored of playing the same songs again and again,"['Truth is you never get something similar to Flow with Spotify. They give you daily mixes.', 'I don’t understand this. There are millions of songs on Spotify. Millions. If you’re playing the same songs over and over again that’s your fault, not the system.']",3,0.16664084163252954,spotify
Do spotify gift cards still not work with Hulu plan?,"Sam's has a Spotify GC today for $84 for the year...trying to see if it is worth buying. I almost never use Hulu anyway so it wouldn't be a huge loss, but I wondered if there was a way to avoid it. They have my CC number on file already if that matters (seemed to matter for the Google Home promo, which I received).",0,0,0.18605056392373862,spotify
Avenue is a lo-fi playlist I've been adding songs to on and off since around the beginning of 2018. I hope you enjoy some of it!,,"[""Greetings! I have a few new tracks that may fit your playlist. I'd appreciate if you take a listen when you have a moment. Thank you in\xa0advance.\n\nHere's the Spotify links\n\n[https://open.spotify.com/track/3Npf6J5ANSrGwcRlz0yGCz](https://open.spotify.com/track/3Npf6J5ANSrGwcRlz0yGCz)\n\n[https://open.spotify.com/track/2YJjctEzQErO6bL0TLCYDR](https://open.spotify.com/track/2YJjctEzQErO6bL0TLCYDR)""]",1,0.18922186034697072,spotify
"Sad LoFi Playlist, submissions are open, drop your stuff down below",,"['I like!', ""Greetings! I have a few new tracks that may fit your playlist. I'd appreciate if you take a listen when you have a moment. Thank you in\xa0advance.\n\nHere's the Spotify links\n\n[https://open.spotify.com/track/3Npf6J5ANSrGwcRlz0yGCz](https://open.spotify.com/track/3Npf6J5ANSrGwcRlz0yGCz)\n\n[https://open.spotify.com/track/2YJjctEzQErO6bL0TLCYDR](https://open.spotify.com/track/2YJjctEzQErO6bL0TLCYDR)""]",4,0.20319176790614923,spotify
"80s Synthpop, Alternative, and Club Music",,0,0,0.2040251012974315,spotify
"This is my rap/hip-hop playlist I have a mix of gangsta rap, dark trap, nerdcore, and other stuff on here",,0,0,0.26747417542945456,spotify
What are some songs that anyone will definitely love no matter what?,,0,0,0.2878792680882745,spotify
Desktop Spotify dealbreaking bug,"The past week now i'll be listening to music then randomly it'll spike the volume up to max so loud I freaking jump and my ears hurt, this happens at least twice a day and honestly thinking about not renewing this month and I've been on spotify for years. I can't deal with this BS and jumpscares everyday",['If other people aren’t having the same problem it might be a problem with your computer and unrelated to Spotify. Have you tried reinstalling Spotify? What about listening to something else like a movie and seeing if that happens? What about a different set of headphones?'],1,0.3005413052660447,spotify
"21 new independent releases ft. Longy, Ellie Dixon, The Trusted, MILLY, Mike Liegel, Lanterns on the Lake, Costi, Dramalove, Wild Year, Karolina Rose, Night Hikes, Saint Taint, GRMLN, MAUGER, Tidal Volume, Bendigo Fletcher, Lune Rose, Faultress, Sego + Comfort the Killer, Nana Adjoa, Lauran Hibberd",,['Every week I listen to around 400 -500 new releases from independent artists & bands.  I narrow them down to a shortlist of around 60 tracks.  From that shortlist I select 21 of the best based on how they flow together as a playlist and reflect the range of genres/styles I heard that week.\n\n\\+ all the tracks released this week\n\n\\+ the average number of monthly listeners per artist this week is 20k.\n\n\\+ 1 hr 12 mins of new music to discover!'],1,0.30570334236103075,spotify
If you're being hunted you can listen to this playlist meanwhile. - Thrilling Hunt Music,,0,0,0.3110042683559435,spotify
Playlist help,,"['For context, playlist is for a 6th year holiday (final year of secondary education) after we complete our exams next summer. Tryna get in that mood. I have posted 3 songs in it so far. If you understand the vibe pls follow it and comment some song suggestions. The holiday consists of drugs, sex, girls , alcohol, beach vibes. \n\nTryna get in the mood right now and perfect it to keep me motivated.\n\n&#x200B;\n\nThanks.']",1,0.3279255648040109,spotify
Is mobile spotify virtually unsuable?,"For 1 year i stuck on the web/desktop version and can usually can do these things:

-start shuffle play at any songs

-start from anywhere,on demand in your playlist

-selecting repeat/repeat playlist

Then i've come back to mobile after updating and seeing the UI now is like f***ing unusable because of these things:

-the cringy ""we added"" list that literally ruins the mood of the playlist(i suspect this is like a shove-it-up-your-arse version of autoplay)

-only can hear previews of songs(instead of the, you know, **THE WHOLE SONG?**. Is this becoming shazam's song preview thing?)

-no repeat(a bit enraging)

should i stick to this utter mess of a UI redesign or is there a viable alternative?

Sorry for mobile formatting in advance","[""Yeah,it's totally useless in mobile""]",1,0.34586537962986363,spotify
"Is there any way to recover a song that I accidentally dismissed in the ""Recommended songs"" section that plays after one of my playlists is done?","Basically I was listening to a playlist of mine (on my phone) and once all the songs were played it went to the ""recommended songs"" based on the playlist. 

I heard a song I really liked and while trying to add it to my playlist I accidentally hit the ""delete"" or dismiss button. Is there any way to see the songs I've dismissed? 

I also checked my Spotify history but it only works on my laptop and didn't show me the songs I played on my phone (which is an iphone) :(

Is there any way for me to recover this song?","[""I don't think theres an option. That's why you should have last.fm. it scrobbles all your songs when it's linked to your spotify account""]",2,0.3475899167938365,spotify
late night drive playlist - hiphop / RnB 🦋,,0,0,0.34995102803188344,spotify
how do I recover a song that I accidentally removed from my library,I accidentally removed a song from my very long library and I have no idea which one it is. is there any way I can undo this action???,"[""Well, you obviously dont miss it, but one day you will, then BOOM, you'll remember it, and you'll be reunited!"", 'If you’ve listened to it recently you can check your play history.']",3,0.3556223247227846,spotify
Can we already have a lyrics option just like Apple Music’s?,"Spotify is a great option compared to its rivals, however, The UI needs to improve greatly, It needs to become smooth and elegant just like Apple Music’s, 

And we also need a god damn lyrics option so we wouldn’t have to go to google and search the lyrics every single time just like Apple Music.","['Real OGs know that Spotify did have lyrics. Then it was replaced by a message that something even better would be coming. Then it was replaced by nothing and has never returned.', ""That would be nice. I have recently started a deezer 3 month trial and didn't even realized that had lyrics but they  have a pretty good chunk and I like how they go about it. I hate how Apple incorporates it having a dedicated button and removing the + sign. \n\nI wish deezer had Spotify library because it's missing a lot that Spotify does have. \n\nI feel lyrics should be one of the more simple things."", 'Certain songs have some lyrics with some explanations from Genius', 'I’m on the 3 month Apple Music trial right now and the lyrics feature they have is amazing. You can tap on a lyric and it’ll skip the song to when that lyric is sung, it’s amazing. Plus the visualizer based on the album art that is in the background looks gorgeous.', 'Lyrics would be AMAZING! Amazon has them on some songs', 'I have a Japanese Spotify account and it has lyrics for a lot of songs. They come up in place of the behind the lyrics crap.', 'Try musixmatch!', 'I second this', 'Yes. Absolutely. Streaming platforms like JOOX also had lyrics (from third parties).', ""I mean songs have this Genius thing at the bottom, but hey aren't that good in my opinion"", ""It's like Spotify has stopped giving an F about everything.. UI, Lyrics, seamless experience, eliminating confusion... It's just a mess.. I haven't opened up Apple Music in a minute because I love Spotify.. Wonder what it looks like.""]",37,0.37667556561529636,spotify
Artist suggestions?,Any way to have spotify ban an artist from my profile? Getting really tired of certain artists being forced on me. Looking at you Logic,['Go to the artists page -> click the three dot button -> click “Don’t play this artist”'],1,0.38576121383243134,spotify
"As soon as I get Spotify Premium for 6 months for free, someone changes the email to my account","and literally the only thing I can do is email them and pray they ever respond, which they probably won't. There's no troubleshooting, no reverse button just in case, no proving it's really you. Just email and pray.","[""I'd love if everyone who uses this sub just left the service. It's shit. I just don't want apple music and I also hate Google. They don't have any decent support, shit UI and shit UX.""]",2,0.3951014918282076,spotify
"When I play ""I Love My '90s Hip-Hop"" playlist, it goes back playing automatically the first song, after one song is finished. How do I fix this? It's in shuffle mode and I would like to listen the songs randomly.",,0,0,0.4000320474417121,spotify
Data usage spike,"My family has a limited data plan of only a 4gbs a month, and usually that is perfectly fine for us. However last night something happened with my brother. In the span of 2 hours, spotify used 2.49 gbs of data. he usually doesnt even use .5 gbs over the course of a month. I dont know what caused this, neither does he, but if you guys have any advice it would be appreciated. From my experience, even having spotify with data on for several hours should not use more than 1gb.",['He probably downloaded some app that’s transmitting a load of data.'],1,0.4027172326406947,spotify
"On Spotify Mobile, why is it for Rap Caviar, sometimes I can play whatever song is in that playlist but sometimes I can only shuffle play it?",I'm not Premium btw.,0,0,0.42008991796109413,spotify
Dark RnB / Trap Playlist. A pretty specific aesthetic that I spent hours looking for enough songs for--hope you enjoy!,,0,0,0.4666524180328404,spotify
"A guitar playlist with a difference! From Hawaii to Africa, India to Japan, North America to the Middle East and more... a feast of guitar driven world music!",,0,0,0.47356214041787165,spotify
Our Culture Playlist is filled with the cream of the crop of the underground & undiscovered Hip-Hop Culture❗️Updated Regularly & Submission Open ❗️Enjoy‼️,,0,0,0.48868945535962227,spotify
"I've been creating this playlist for over a year, it contains all the tracks I get sent from SubmitHub. Some of these bands have gone on to be huge like Black Midi or will be huge. Its well worth checking out.",,0,0,0.4950899183805342,spotify
Top House Beats - Spotify Playlist [Dance],,0,0,0.5176130665976693,spotify
"I have mad a playlist with the most soulful, peaceful {instrumental} music a know, it will help your mind levitate from your body, to finally become a free Spirit ;). Enjoy",,['Thanks for sharing.'],2,0.5283190851851747,spotify
Playlist of my favourite jazz tunes,,0,0,0.5537820482861113,spotify
New music discovery this week. Check it out and have a great weekend!,,"['Cool curation! Can I do a song suggestion?', 'Thank you']",3,0.6051593631699129,spotify
google home mini out of stock?,will it restock or am I out of luck?,"['did you check all colors? i know the orange and blue were out of stock but they still had black and silver. this was a few hours ago, though.']",14,0.6339788076750658,spotify
what is the best eq setting for punk rock and metal?,"im not good at these kinds of posts, so thanks i guess?",0,0,0.6359464003338858,spotify
Hi this is my rad ass playlist. Enjoy!,,0,0,0.6492913078571911,spotify
My current top 50 updated frequently.,,['Cool curation! Can I do a song suggestion?'],1,0.654048252362344,spotify
Is this a scam?,"Just got charged twice for the ""free"" google mini.  What the hell is this?  Anybody else experience this?  The first time paypal rejected it from an old card used, the second time it went through.  But I'm seeing two pending charges.",0,0,0.6701593635396825,spotify
2019 mega indie playlist 🔥,,[' Cool curation! Can I do a song suggestion?'],5,0.7046153821299473,spotify
"Psychedelic Trip Hop, a playlist by Ayoub Bourhim on Spotify",,0,0,0.7209464007754017,spotify
Free Google home mini questions. Help!,"I'm new to spotify and it said I can get free Google home mini if I subscribe to premium. So I checked the premium options and I found out that I can get free premium individual for 3 months.
Can I still get Google home mini with this free subscription? 

Also I live in South Korea so I illegally (I used VPN) downloaded Spotify. Can I still get Google home mini?","[""You need to forfeit the trial and pay for Premium to get it\n\nAlso, you may have a problem having it shipped to SK bec it's exclusively available to US customers, so idk how that'll work when you check out from google store and use an address abroad""]",1,0.8006107526962404,spotify
This is a brand new artist who i think you guys and girls would love...please comment on what you think of him.,,['0'],1,0.81081908610132,spotify
Spotify double scrobbling on last.fm,Anyone know how to fix this? Is it an issue with Spotify of Last.fm?,['Probably your settings in last.fm. It’s been working fine for me.'],2,0.8243723268972503,spotify
Stop putting Mitski in every possible song's radio playlist!,"I use to love clicking on a song's radio playlist, but for the past couple of months, no matter what artist I'm listening to, it puts like 3-4 songs from Mitski or Snailmail in that playlist. I get it, Spotify..you registered at one point that I sometimes enjoy new alternative woman singers (I don't think I ever even ""liked"" a Mitski song for them to push her stuff at me) but when I click on a playlist for say Twilight Sad or even as far out as Wham! and it's trying to convince me Mitski is in the same genre of music, it makes me lose faith in Spotify's playlists algorithms. Is this happening to anyone else??","[""It's so weird how this app keeps getting worse and worse.""]",2,0.8605644569683959,spotify
"The song on my Apple Watch is stuck. Every single time I turn Spotify on and off on my phone, no matter what happens, it stays on the same song on my watch and doesn’t change the name. Does anybody know how to fix this?","I have Powerbeats pro, the wireless edition. I don't know if that makes a difference.  It changes songs, and I’m able to listen to what I want. But whenever I turn my wrist to look at what song is playing, the same song appears all the time no matter what I’m actually listening to.","['Force close the app on the watch.  While on the app, hold down the side button untill the power off menu pops up. Then hold down the crown until it returns to the watch face.']",1,0.8850089015839276,spotify
"i'm trance baby: 436 Songs, 34 Hours of Trance Music - Regularly updated!",,0,0,0.898110753496488,spotify
"wild hearts - a playlist inspired by love, simon ♡",https://open.spotify.com/user/d5xowzvg22o7g3jceugr95oj5/playlist/3Cny7VUXVyKckQeSpjorGa?si=w0c8cWY1STqAsFPQiqhOCw,0,0,0.9208422350469563,spotify
How,So there’s a random playstation connecting to my Spotify it keeps connecting and playing music. Is there a way to blacklist it or something,"['If you go on the spotify website you can log out on all devices, then change your password to stop them logging back in']",2,0.9327635314591506,spotify
Jonas brothers new christmas song = new fire christmas playlist with some old faves,"[https://open.spotify.com/playlist/5hq4JOsOQyUdW7fsyGcCmA?si=UXREpgbzTayCrnABffV6KQ](https://open.spotify.com/playlist/5hq4JOsOQyUdW7fsyGcCmA?si=UXREpgbzTayCrnABffV6KQ)

&#x200B;

go drop a follow :)",0,0,0.9356223278244337,spotify
"I made a lofi / chill playlist with my 50 favorites tracks, lot of nostalgic vibes",,0,0,0.9674278834379382,spotify
"Best Music for Relaxing, Study, Stress, Healing, Calm, Cafe, Yoga, Therapy, Meditation, Sleep, Peace, a playlist by Eunice Chang on Spotify",,0,0,0.9707959390624806,spotify
All Out 80s,,0,0,0.9718954762154155,spotify
Just got charged 53 bucks,Spotify is currently doing a promotion for a free Google Home mini. So I signed up for one and did all the steps and was still charged 53 dollars to my debit card. Do not try it.,"['You’re doing it wrong. The total should be zero, why would you click to check out if it’s not zero?', 'My checkout screen had a coupon for the full price of the unit. No tax, no shipping. $0', 'I was about to do it and noticed it tried charging me $49, luckily I noticed before I finalized it, what a scam']",4,1.0062126059140322,spotify
Sounds just like Bob Dylan!,,0,0,1.0083538097695068,spotify
"Melancholic rap vibes to drive through the night (Russ, Post Malone, Drake, 6lack) -updated weekly",,"[""Hey, love the playlist! It's exactly my vibe. If you take submissions, check out this song of mine: it fits the melancholy, chill vibe IMO https://open.spotify.com/track/4uaeknBhSX92d66gRl1ZbQ?si=8iMfAm16Rza8jItk4rYu-w""]",1,1.0386547357506222,spotify
breaking bass 🎧 gaming/workout playlist 🎧 dubstep/riddim/trap,,0,0,1.0646616803109645,spotify
Very inspirational,,['Nobody falling for this shit'],1,1.073457976794905,spotify
I’m at 99 songs and I would like suggestions for my 100th (Dance Playlist),,"['“You Gotta Dance” by Alice Cooper', 'Crystal Castles “Crimewave”', 'Cool curation! Here’s one :) https://open.spotify.com/track/4JE9y00vsXO2q7iriDKHA6?si=lim7eZVgTZmF6tLYjryuaQ']",4,1.0736431620463178,spotify
